FE486L, TOPICS IN ECONOMICS
FE486R, ADVANCED TOPICS IN ECONOMICS
FE486V, ADVANCED TOPICS IN ECONOMICS
FE491, TOPICS IN ECONOMICS
FE493, TOPICS IN ECONOMICS
FE494, TOPICS IN ECNOMICS
FE495, TOPICS IN ECONOMICS
FE496, TOPICS IN ECONOMICS
FE500, HONORS RESEARCH SEMINAR I
FE506, HONORS RESEARCH PROJECT
FE520, HONORS COURSE
FE523, ECONOMETRICS
FE589, TRIDENT SCHOLAR PROJECT
FE593, TRIDENT SCHOLAR PROJECT
FF101, BASIC FRENCH I
FF102, BASIC FRENCH II
FF201, INTERMEDIATE FRENCH I
FF202, INTERMEDIATE FRENCH II
FF281A, TOPICS IN FRENCH
FF281B, TOPICS IN FRENCH
FF282A, TOPICS IN FRENCH
FF282B, TOPICS IN FRENCH
FF286, TOPICS IN FRENCH
FF301, ADVANCED FRENCH WITH CIVILIZATION READINGS I
FF302, ADVANCED FRENCH WITH CIVILIZATION READINGS II
FF411, DEVELOPMENT OF FRENCH CIVILIZATION
FF412, MODERN FRANCE
FF421, REPRESENTATIVE READINGS IN FRENCH LITERATURE I
FF422, REPRESENTATIVE READINGS IN FRENCH LITERATURE II
FF432, FRANCE AND THE ARAB WORLD
FF481, SEMINAR IN FRENCH LITERATURE I
FF482, SEMINAR IN FRENCH LITERATURE II
FF485, ADVANCED TOPICS IN FRENCH
FF486, ADVANCED TOPICS IN FRENCH
FF486A, ADVANCED TOPICS IN FRENCH
FF486B, ADVANCED TOPICS IN FRENCH
FG101, BASIC GERMAN I
FG102, BASIC GERMAN II
FG201, INTERMEDIATE GERMAN I
FG202, INTERMEDIATE GERMAN II
FG310, INTRODUCTION TO CONTEMPORARY GERMANY
FG320, INTRODUCTION TO GERMAN LITERATURE
FG411, DEVELOPMENT OF GERMAN CIVILIZATION
FG412, MODERN GERMANY
FG421, REPRESENTATIVE READINGS IN GERMAN LITERATURE I
FG422, REPRESENTATIVE READINGS IN GERMAN LITERATURE II
FG485, ADVANCED TOPICS IN GERMAN
FG486, ADVANCED TOPICS IN GERMAN
FJ101, BASIC JAPANESE I
FJ102, BASIC JAPANESE II
FJ201, INTERMEDIATE  JAPANESE I
FJ202, INTERMEDIATE  JAPANESE II
FJ281, TOPICS IN JAPANESE
FJ281B, TOPICS IN JAPANESE
FJ282, TOPICS IN JAPANESE
FJ282A, TOPICS IN JAPANESE
FJ285E, TOPICS IN JAPANESE
FJ301, ADVANCED JAPANESE I
FJ301X, ADVANCED JAPANESE I
FJ302, ADVANCED JAPANESE II
FJ302X, ADVANCED JAPANESE II
FJ411, ADV JAPANESE TRANSLATION AND INTERPRETATION
FJ412, ADVANCED JAPANESE CONVERSATION
FJ425, MEDIA STUDIES IN JAPANESE
FJ481, ADV TOPICS IN JAPANESE
FJ482, ADV TOPICS IN JAPANESE
FJ485, ADVANCED TOPICS IN JAPANESE
FJ485A, ADVANCED TOPICS IN JAPANESE
FJ485B, ADVANCED TOPICS IN JAPANESE
FJ485E, ADVANCED TOPICS IN JAPANESE (ENG)
FJ486, ADVANCED TOPICS IN JAPANESE
FJ486A, ADVANCED TOPICS IN JAPANESE
FJ486B, ADVANCED TOPICS IN JAPANESE
FJ486E, ADVANCED TOPICS IN JAPANESE (ENG)
FK486, INDEPENDENT STUDY IN KOREAN
FL220, LANGUAGE AND LINGUISTICS
FL281, TOPICS IN LANGUAGES AND CULTURES
FL283, TOPICS IN LANGUAGES AND CULTURES
FL285, TOPICS IN LANGUAGE STUDIES
FL286, TOPICS IN LANGUAGE STUDIES
FL301, INTERCULTURAL COMMUNICATION
FL302, INTRO TO CULTURAL ANTHROPOLOGY
FL471A, SEMESTER ABROAD PRE-DEPART INTERCULTURAL SEMINAR
FL471B, SEMESTER ABROAD IN COUNTRY INTERCULTURAL SEMINAR
FL471C, SEMESTER ABROAD RE-ENTRY INTERCULTURAL SEMINAR
FL480, IT RESEARCH SEMINAR (FL)
FL481A, ADVANCED TOPICS IN LANGUAGES & CULTURES
FL481B, ADVANCED TOPICS IN LANGUAGES & CULTURES
FL481C, ADVANCED TOPICS IN LANGUAGES & CULTURES
FL485, ADVANDED TOPICS IN LANGUAGE STUDIES
FL486, ADVANCED TOPICS IN LANGUAGE STUDIES
FP130, U. S. GOVERNMENT AND CONSTITUTIONAL DEVELOPMENT
FP130A, U.S. GOVERNMENT AND CONSTITUTIONAL DEVELOPMENT
FP130N, U.S. GOVERNMENT AND CONSTITUTIONAL DEVELOPMENT
FP130X, U. S. GOVERNMENT AND CONSTITUTIONAL DEVELOPMENT
FP210, INTRODUCTION TO INTERNATIONAL RELATIONS
FP220, POLITICAL SCIENCE METHODS
FP230, INTRO TO COMPARATIVE POLITICS
FP286A, TOPICS IN POLITICAL SCIENCE
FP310, INTRODUCTION TO GLOBAL STRATEGIC STUDIES
FP311, ETHICS AND INTERNATIONAL RELATIONS
FP313, INFORMATION TECHNOLOGY AND INTERNATIONAL POLITICS
FP314, FORMULATION OF U. S. FOREIGN POLICY
FP320, ADV POLITICAL SCI METHODS
FP322, COMPARATIVE EUROPEAN POLITICS
FP323, COMPARATIVE LATIN AMERICAN POLITICS
FP324, LATIN AMERICAN INTERNATIONAL POLITICS
FP325, AMERICAN POLITICAL PHILOSOPHY
FP326, AMERICAN PRESIDENCY
FP328, LEGISLATIVE PROCESS
FP335, NON-DEMOCRATIC POLITICS
FP340, MODERN POLITICAL THOUGHT AND IDEOLOGY
FP341, POLITICAL PSYCHOLOGY
FP345, ENVIRONMENTAL POLITICS AND SECURITY
FP350, POLITICAL ECONOMY
FP355, CIVIL-MILITARY RELATIONS
FP356, CONFLICT AND PEACEMAKING
FP357, POLITICS OF CHINA AND JAPAN
FP358, POLITICS OF SOUTHEAST ASIA
FP360, MIDDLE EAST INTERNATIONAL POLITICS
FP364, VIETNAM:  PERSPECTIVES ON THE CONFLICT
FP365, AFRICAN COMPARATIVE POLITICS
FP366, AFRICAN INTERNATIONAL RELATIONS
FP367, POLITICS OF RUSSIA AND THE CIS
FP368, COMPARATIVE ASIAN POLITICS
FP369, MIDDLE EASTERN POLITICS
FP370, FOREIGN POLICY OF RUSSIA AND CIS
FP371, ASIAN INTERNATIONAL POLITICS
FP372, "POLITICAL PARTIES,  CAMPAIGNS AND INTEREST GROUPS"
FP375, POLITICS AND THE MEDIA
FP384, POLITICS OF IRREGULAR WARFARE
FP394, POLITICAL THEORY
FP397, CRIMINAL LAW AND JUSTICE
FP403, ADVANCED RESEARCH SEMINAR IN WASHINGTON
FP407, INTELLIGENCE AND NATIONAL SECURITY
FP408, INTERNATIONAL LAW
FP413, CONSTITUTIONAL LAW:  FEDERAL SYSTEM
FP414, CONSTITUTIONAL LAW: CIVIL LIBERTIES
FP420, PUBLIC POLICY ANALYSIS
FP421, NATIONAL SECURITY POLICY
FP430, POLITICAL PHILOSOPHY
FP437, INTERNATIONAL ORGANIZATIONS
FP440, POLITICS OF CENTRAL EUROPE
FP450, INTERNATIONAL POLITICAL ECONOMY
FP460, CLASS OF 1960 SPECIAL TOPICS IN NATL SECURITY
FP460B, CLASS OF 1960 SPECIAL TOPICS IN NATL SECURITY
FP462, SPECIAL TOPICS IN COMPARATIVE POLITICS
FP468, PALESTINIAN - ISRAELI CONFLICT
FP469, ISLAM AND POLITICS
FP471, CAPSTONE SEMINAR
FP471A, CAPSTONE SEMINAR
FP471B, CAPSTONE SEMINAR
FP471C, CAPSTONE SEMINAR
FP471D, CAPSTONE SEMINAR
FP471E, CAPSTONE SEMINAR
FP471F, CAPSTONE SEMINAR
FP471G, CAPSTONE SEMINAR
FP471H, CAPSTONE SEMINAR
FP480, IT RESEARCH SEMINAR (FP)
FP481, ADVANCED TOPICS IN POLITICAL SCIENCE
FP482, ADVANCED TOPICS IN POLITICAL SCIENCE
FP482A, ADVANCED TOPICS IN POLITICAL SCIENCE
FP482B, ADVANCED TOPICS IN POLITICAL SCIENCE
FP483, ADVANCED TOPICS IN POLITICAL SCIENCE
FP485, ADVANCED TOPICS IN POLITICAL SCIENCE
FP485A, ADVANCED TOPICS IN POLITICAL SCIENCE (FPSA)
FP485B, ADVANCED TOPICS IN POLITICAL SCIENCE (FPSA)
FP485C, ADVANCED TOPICS IN POLITICAL SCIENCE (FPSC)
FP485D, ADVANCED TOPICS IN POLITICAL SCIENCE (FPSC)
FP485E, ADVANCED TOPICS IN POLITICAL SCIENCE
FP485F, ADVANCED TOPICS IN POLITICAL SCIENCE
FP485G, ADVANCED TOPICS IN POLITICAL SCIENCE
FP485H, ADVANCED TOPICS IN POLITICAL SCIENCE
FP485I, ADVANCED TOPICS IN POLITICAL SCIENCE (FPSI)
FP485J, ADVANCED TOPICS IN POLITICAL SCIENCE (FPSI)
FP485K, ADVANCED TOPICS IN POLITICAL SCIENCE (FPSI)
FP486, ADVANCED TOPICS IN POLITICAL SCIENCE
FP486A, ADVANCED TOPICS IN POLITICAL SCIENCE (FPSA)
FP486B, ADVANCED TOPICS IN POLITICAL SCIENCE (FPSA)
FP486C, ADVANCED TOPICS IN POLITICAL SCIENCE (FPSC)
FP486D, ADVANCED TOPICS IN POLITICAL SCIENCE (FPSC)
FP486E, ADVANCED TOPICS IN POLITICAL SCIENCE
FP486F, ADVANCED TOPICS IN POLITICAL SCIENCE
FP486I, ADVANCED TOPICS IN POLITICAL SCIENCE (FPSI)
FP486J, ADVANCED TOPICS IN POLITICAL SCIENCE (FPSI)
FP486K, ADVANCED TOPICS IN POLITICAL SCIENCE (FPSI)
FP486L, OLIN SEM:  INT NEG
FP486M, OLIN SEM IN NAT SEC ISSUES
FP486O, ETHICS AND I.R.
FP493, TOPICS IN POLITICAL SCIENCE
FP495, POLITICAL SCIENCE RESEARCH
FP495A, POLITICAL SCIENCE RESEARCH
FP495B, POLITICAL SCIENCE RESEARCH
FP495R, POLITICAL SCIENCE RESEARCH
FP496, POLITICAL SCIENCE RESEARCH
FP496A, POLITICAL SCIENCE RESEARCH
FP496B, POLITICAL SCIENCE RESEARCH
FP500, HONORS ADVANCED RESEARCH DESIGN
FP505, HONORS SENIOR SEMINAR
FP506, HONORS IND RSCH
FP507, HONORS INTERNSHP RSCH
FP509, HONORS SENIOR SEMINAR
FP510, HONORS SENIOR THESIS
FP520, HONORS RESEARCH DESIGN
FP530, HONORS ADVANCED RESEARCH DESIGN
FP540, HONORS SENIOR SEMINAR
FP592, TRIDENT SCHOLAR PROJECT
FR101, BASIC RUSSIAN I
FR102, BASIC RUSSIAN II
FR201, INTERMEDIATE RUSSIAN I
FR202, INTERMEDIATE RUSSIAN II
FR281A, TOPICS IN RUSSIAN
FR281B, TOPICS IN RUSSIAN
FR282A, TOPICS IN RUSSIAN
FR282B, TOPICS IN RUSSIAN
FR330, THIRD YEAR RUSSIAN I
FR340, THIRD YEAR RUSSIAN II
FR350, RUSSIAN LIT & CULTURE IN TRANSLATION
FR411, ADVANCED RUSSIAN
FR412, CONTEMPORARY RUSSIA
FR460, ADVANCED RUSSIAN THROUGH FILM
FR481, SEMINAR IN RUSSIAN
FR482, SEM IN RUSS LIT II
FR483, ADVANCED TOPICS IN RUSSIAN
FR484, ADVANCED TOPICS IN RUSSIAN
FR485, ADVANCED TOPICS IN RUSSIAN
FR485A, ADVANCED TOPICS IN RUSSIAN
FR486, ADVANCED TOPICS IN RUSSIAN
FR486A, ADVANCED TOPICS IN RUSSIAN
FR486B, ADVANCED TOPICS IN RUSSIAN
FR495, RUSSIAN RESEARCH PROJECT
FS101, BASIC SPANISH I
FS102, BASIC SPANISH II
FS103, BASIC SPANISH I
FS104, BASIC SPANISH II
FS201, INTERMEDIATE SPANISH I
FS202, INTERMEDIATE SPANISH II
FS286, TOPICS IN SPANISH
FS301, ADV SPANISH W/ READINGS ON CONTEMP SPANISH AMERICA
FS304, ADVANCED SPANISH WITH READINGS ON CONTEMPORARY SPA
FS412, CONTEMPORARY LATIN AMERICAN CIVILIZATION
FS413, SPANISH CIVILIZATION
FS421, SPANISH LITERATURE
FS422, SPANISH AMERICAN LITERATURE
FS481, ADVANCED TOPICS IN SPANISH
FS481A, ADVANCED TOPICS IN SPANISH
FS482, ADVANCED TOPICS IN SPANISH
FS482A, SEMINAR IN SPANISH
FS482B, ADVANCED TOPICS IN SPANISH
FS484, ADVANCED TOPICS IN SPANISH
FS485, ADVANCED TOPICS IN SPANISH
FS485A, ADVANCED TOPICS IN SPANISH
FS485E, ADV TOPICS IN SPANISH (ENG)
FS486, ADVANCED TOPICS IN SPANISH
FS486A, ADVANCED TOPICS IN SPANISH
FS486E, ADV TOPICS IN SPANISH (ENG)
FS496, SPANISH RESEARCH PROJECT
FS496I, SPANISH INDEPENDENT STUDY
FX101, ENGLISH FOR NON-NATIVE SPEAKERS I
FX102, ENGLISH FOR NON-NATIVE SPEAKERS II
FX285, TOPICS IN LANG & CULTURES FOR NON-NATIVE SPEAKERS
HE044, PRACTICAL WRITING LABORATORY
HE044X, PRACTICAL WRITING LABORATORY
HE101, PRACTICAL WRITING
HE101E, PRACTICAL WRITING
HE101X, PRACTICAL WRITING
HE111, RHETORIC AND INTRO TO LITERATURE I
HE111N, RHETORIC AND INTRODUCTION TO LITERATURE I
HE111S, RHETORIC AND INTRO TO LITERATURE I
HE111W, RHETORIC AND INTRO TO LITERATURE I
HE111X, RHETORIC AND INTRO TO LITERATURE I
HE112, RHETORIC AND INTRO TO LIT II
HE112F, RHETORIC AND INTRO TO LIT II
HE112N, RHETORIC AND INTRODUCTION TO LITERATURE II
HE112S, RHETORIC AND INTRO TO LIT II
HE112V, RHETORIC AND INTRO TO LIT II
HE112W, RHETORIC AND INTRO TO LIT II
HE200, INTENSIVE WRITING
HE217, EARLY WESTERN LITERATURE
HE217T, WESTERN LIT I
HE218, ANGLO-AMERICAN LITERATURE
HE222, THE BIBLE AND LITERATURE
HE224, LITERATURE AND SCIENCE
HE240, AFRICAN-AMERICAN LITERATURE
HE242, METHODS OF LITERARY ANALYSIS
HE250, LITERATURE OF THE SEA
HE260, LITERATURE OF WAR
HE285, TOPICS IN ENGLISH
HE285A, TOPICS IN ENGLISH
HE285B, TOPICS IN ENGLISH
HE285C, TOPICS IN ENGLISH
HE286, TOPICS IN ENGLISH
HE301, PATTERNS IN DRAMA
HE302, FORMS OF POETRY
HE306, TYPES OF FICTION
HE307, TOPICS IN FILM AND LITERATURE
HE313, CHAUCER AND HIS AGE
HE314, THE RENAISSANCE MIND
HE315, RESTORATION AND EIGHTEENTH-CENTURY LITERATURE
HE317, THE ROMANTIC PERIOD
HE318, MODERN BRITISH LITERATURE
HE319, VICTORIAN LITERATURE
HE320, CONTEMPORARY BRITISH LIT.
HE326, "AMERICAN LIT,  1607-1860"
HE328, "AMERICAN LIT,  1860-1914"
HE329, "AMERICAN LIT,  1914-1945"
HE330, "AMERICAN LIT,  1945-PRESENT"
HE333, SHAKESPEARE
HE340, AFRICAN-AMERICAN LITERATURE
HE343, CREATIVE WRITING
HE344, PROFESSIONAL COMMUNICATION
HE353, TOPICS IN CONTINENTAL LIT.
HE355, TOPICS IN MULTI-ETHNIC LITERATURE
HE360, SPECIAL TOPICS IN LITERATURE
HE360A, SPECIAL TOPICS IN LITERATURE
HE360B, SPECIAL TOPICS IN LITERATURE
HE388, PROFESSIONAL COMM & WRITING LAB
HE442, LITERARY THEORY
HE461, STUDIES IN A LITERARY PERIOD
HE462, STUDIES IN A LITERARY PROBLEM
HE463, STUDIES IN LITERARY FIGURES
HE463A, STUDIES IN LITERARY FIGURES
HE463B, STUDIES IN LITERARY FIGURES
HE467, STUDIES IN A LITERARY GENRE
HE485, ADVANCED TOPICS IN ENGLISH
HE485A, ADVANCED TOPICS IN ENGLISH
HE486, ADVANCED TOPICS IN ENGLISH
HE491, IND RSCH/ENGLISH
HE492, INDEPEND RESEARCH/ENGLISH
HE493, IND RSCH/ENGLISH
HE494, INDEPEND RESEARCH/ENGLISH
HE495, IND RSCH/ENGLISH
HE495A, INDEPENDENT RESEARCH ENGLISH
HE495B, INDEPENDENT RESEARCH ENGLISH
HE496, INDEPEND RESEARCH/ENGLISH
HE503, SEMINAR IN ARTS & LITERATURE
HE504, SEMINAR IN AN ADVANCED TOPIC
HE506, SEMINAR IN ARTS & LITERATURE
HE507, SEMINAR IN AN ADVANCED TOPIC
HE521, HONORS SUPPLEMENT I
HE522, HONORS SUPPLEMENT II
HH104, AMERICAN NAVAL HISTORY
HH104N, AMERICAN NAVAL HERITAGE
HH104X, AMERICAN NAVAL HISTORY
HH205, WESTERN CIVILIZATION:  CULTURE TO 1776
HH205P, WESTERN CIVILIZATION TO 1776
HH206, CIVILIZATION AND THE ATLANTIC COMMUNITY SINCE 1776
HH215, THE WEST IN THE PREMODERN WORLD
HH215A, ASIA IN THE PREMODERN WORLD
HH215M, THE MIDDLE EAST IN THE PREMODERN WORLD
HH215P, THE WEST IN THE PREMODERN WORLD
HH216, THE WEST IN THE MODERN WORLD
HH220, IT REVOLUTIONS: PAST & PRESENT
HH262, PERSPECTIVES ON HISTORY
HH262A, PERSPECTIVES ON HISTORY
HH262B, PERSPECTIVES ON HISTORY
HH262C, PERSPECTIVES ON HISTORY
HH262D, PERSPECTIVES ON HISTORY
HH262E, PERSPECTIVES ON HISTORY
HH262F, PERSPECTIVES ON HISTORY
HH281, TOPICS IN HISTORY
HH285, TOPICS IN HISTORY
HH311, ATHENS: MILITARY DEMOCRACY
HH312, IMPERIAL ROME
HH315, THE AGE OF CHIVALRY AND FAITH
HH316, AGE OF RELIGIOUS WARS
HH317, "INDUSTRIALIZATION,  MODERNISM AND MASS SOCIETY"
HH318, WAR AND SOCIETY IN MODERN EUROPE
HH321, REVOLUTIONARY RUSSIA--PETER THE GREAT TO LENIN
HH322, THE RISE AND FALL OF SOVIET COMMUNISM
HH326, IRELAND AND THE IRISH
HH327, GERMANY AND THE NAZI EXPERIENCE
HH329, MODERN FRANCE:  NAPOLEON TO DEGAULLE
HH330, IMPERIAL ENCOUNTERS
HH331, ART AND IDEAS IN MODERN EUROPE
HH332, GREAT POWER DIPLOMACY
HH337, TOPICS IN EUROPEAN HISTORY
HH337A, TOPICS IN EUROPEAN HISTORY
HH337B, TOPICS IN EUROPEAN HISTORY
HH337C, TOPICS IN EUROPEAN HISTORY
HH345, COLONIAL AMERICA
HH346, REVOLUTIONARY AMERICA AND THE EARLY REPUBLIC
HH347, CIVIL WAR AND RECONSTRUCTION
HH349, EMERGENCE OF MODERN AMERICA 1896-1945
HH350, UNITED STATES SINCE WORLD WAR II
HH352, FILM AND AMERICAN SOCIETY
HH353, AMERICAN SOCIAL HISTORY
HH354, AMERICA IN WORLD AFFAIRS
HH355, ART AND IDEAS IN AMERICAN SOCIETY
HH357, TOPICS IN U.S. HISTORY
HH357A, TOPICS IN U.S. HISTORY
HH357B, TOPICS IN U.S. HISTORY
HH357C, TOPICS IN U.S. HISTORY
HH359, U.S. SECT HIST: THE WEST
HH360, U.S. SECTIONAL HISTORY:  THE SOUTH
HH361, HISTORY OF EAST ASIA
HH362, HISTORY OF THE MIDDLE EAST
HH363, MODERN LATIN AMERICA
HH364, HISTORY OF AFRICA
HH365, PRE-COLUMBIAN AND IBERIAN EMPIRES
HH366, COMPARATIVE WORLD CULTURES
HH367, TOPICS IN REGIONAL HISTORY
HH367A, TOPICS IN REGIONAL HISTORY
HH367B, TOPICS IN REGIONAL HISTORY
HH367C, TOPICS IN REGIONAL HISTORY
HH367D, TOPICS IN REGIONAL HISTORY
HH367E, TOPICS IN REGIONAL HISTORY
HH367F, TOPICS IN REGIONAL HISTORY
HH367S, TOPICS IN REGIONAL HISTORY
HH367T, TOPICS IN REGIONAL HISTORY
HH367U, TOPICS IN REGIONAL HISTORY
HH371, HISTORY OF FILM 1895-1968
HH372, THE GOLDEN AGE OF PIRACY
HH373, HISTORY OF CHRISTIANITY
HH376, HISTORY OF ENGINEERING
HH377, TOPICS IN THEMATIC HISTORY
HH377A, TOPICS IN THEMATIC HISTORY
HH377B, TOPICS IN THEMATIC HISTORY
HH377C, TOPICS IN THEMATIC HISTORY
HH377D, TOPICS IN THEMATIC HISTORY
HH377E, TOPICS IN THEMATIC HISTORY
HH378, HISTORY OF TECHNOLOGY IN PEACE AND WAR
HH379, HISTORY OF IT REVOLUTIONS
HH380, HISTORY OF SCIENCE
HH381, "WARFARE IN THE MIDDLE AGES,  500-1500"
HH382, "WARFARE IN THE AGE OF SAIL,  1500-1815"
HH383, "THE AGE OF TOTAL WAR,  1815-1945"
HH384, RECENT MILITARY AND NAVAL HISTORY
HH385, THE U.S. MARINE CORPS
HH386, TOPICS IN NAVAL/MILITARY HISTORY
HH386A, TOPICS IN NAVAL/MILITARY HISTORY
HH386B, TOPICS IN NAVAL/MILITARY HISTORY
HH386C, TOPICS IN NAVAL/MILITARY HISTORY
HH386D, TOPICS IN NAVAL/MILITARY HISTORY
HH386E, TOPICS IN NAVAL/MILITARY HISTORY
HH386F, TOPICS IN NAVAL/MILITARY HISTORY
HH386G, TOPICS IN NAVAL/MILITARY HISTORY
HH386H, TOPICS IN NAVAL/MILITARY HISTORY
HH386I, TOPICS IN NAVAL/MILITARY HISTORY
HH462, SEMINAR IN ADVANCED STUDIES
HH462A, SEMINAR IN ADVANCED STUDIES
HH462B, SEMINAR IN ADVANCED STUDIES
HH462C, SEMINAR IN ADVANCED STUDIES
HH462D, SEMINAR IN ADVANCED STUDIES
HH462E, SEMINAR IN ADVANCED STUDIES
HH480, IT RESEARCH SEMINAR (HH)
HH481, ADVANCED TOPICS IN HISTORY
HH481A, ADVANCED TOPICS IN HISTORY
HH481B, ADVANCED TOPICS IN HISTORY
HH482, ADVANCED TOPICS IN HISTORY
HH482A, ADVANCED TOPICS IN HISTORY
HH482B, ADVANCED TOPICS IN HISTORY
HH482C, ADVANCED TOPICS IN HISTORY
HH483, ADVANCED TOPICS IN HISTORY
HH484, ADVANCED TOPICS IN HISTORY
HH485, ADVANCED TOPICS IN HISTORY
HH485A, ADVANCED TOPICS IN HISTORY
HH485B, ADVANCED TOPICS IN HISTORY
HH485C, ADVANCED TOPICS IN HISTORY
HH485D, ADVANCED TOPICS IN HISTORY
HH485E, ADVANCED TOPICS IN HISTORY
HH485F, INDEPENDENT STUDY
HH485G, INDEPENDENT STUDY
HH485H, INDEPENDENT STUDY
HH485I, INDEPENDENT STUDY
HH485J, INDEPENDENT STUDY
HH485K, INDEPENDENT STUDY
HH485L, INDEPENDENT STUDY
HH485S, ADVANCED TOPICS IN HISTORY
HH485T, ADVANCED TOPICS IN HISTORY
HH486, ADVANCED TOPICS IN HISTORY
HH486A, ADVANCED TOPICS IN HISTORY
HH486B, ADVANCED TOPICS IN HISTORY
HH486C, ADVANCED TOPICS IN HISTORY
HH486D, ADVANCED TOPICS IN HISTORY
HH486E, ADVANCED TOPICS IN HISTORY
HH486F, ADVANCED TOPICS IN HISTORY
HH486G, ADVANCED TOPICS IN HISTORY
HH486H, ADVANCED TOPICS IN HISTORY
HH486I, ADVANCED TOPICS IN HISTORY
HH486J, ADVANCED TOPICS IN HISTORY
HH486K, ADVANCED TOPICS IN HISTORY
HH486L, ADVANCED TOPICS IN HISTORY
HH486M, ADVANCED TOPICS IN HISTORY
HH486N, ADVANCED TOPICS IN HISTORY
HH486R, ADVANCED TOPICS IN HISTORY
HH488A, ADVANCED TOPICS IN HISTORY
HH491, TOPICS IN HISTORY
HH492, TOPICS IN HISTORY
HH493, ADVANCED TOPICS IN HISTORY
HH494, TOPICS IN HISTORY
HH495, ADVANCED TOPICS IN HISTORY
HH496, TOPICS IN HISTORY
HH496A, INDEPENDENT RESEARCH IN HISTORY
HH507, HONORS HISTORIOGRAPHY
HH507A, HONORS HISTORIOGRAPHY
HH507B, HONORS HISTORIOGRAPHY
HH508, HONORS COLLOQUIUM
HH508A, HONORS COLLOQUIUM
HH508B, HONORS COLLOQUIUM
HH509, HONOR SENIOR THESIS
HH512, HONORS THESIS READINGS
HH522, VISITING SCHOLAR SEM.
HP230, INTRO PHILOSOPHY & LOGIC
HP232, ETHICS
HP336, PHILOSOPHY OF RELIGION
HP340, PHILOSOPHY OF SCIENCE
HP485, CRITIQUE OF MODERNITY
HP486, COMPARATIVE RELIGION
HP492, INDEPENDENT STUDY
HP495, TOPICS IN PHILOSOPHY
HP496, RESEARCH PROJECT
IC210, INTRO TO COMPUTING
IC210L, INTRO TO COMPUTING SUPPLEMENT
IC211, OBJECT ORIENTED PROGRAMMING
IC220, COMPUTER ARCHITECTURE & ORG
IC221, SYSTEMS PROGRAMMING
IC312, DATA STRUCTURES
IC322, COMPUTER NETWORKS
IC411, OPERATING SYSTEMS
IC470, SOFTWARE ENGINEERING
IC480, RESEARCH SEMINAR/CAPSTONE
IM210, INFO TECHNOLOGY MGT
IM330, DECISION SUPPORT SYSTEMS
IM360, INFO RESOURCES MGT
IM450, ENTERPRISE COMPUTING
IM480, IT RESEARCH SEMINAR (IM)
IT100A, INTRODUCTION TO COMPUTERS
IT100B, INTRODUCTION TO COMPUTERS
IT221, DATA STRUCTURES
IT285, CYBER WARFARE
IT300, COMPUTER ARCH AND ORG
IT310, INFORMATION SYSTEMS DOD
IT320, SYSTEMS ANALYSIS AND DESIGN
IT340, INTRO TO NETWORKS
IT350, WEB & INTERNET PROGRAMMING
IT360, APPLIED DATABASE SYSTEMS
IT420, DATABASE MGT & ORG
IT430, COMPUTER AND NETWORK SECURITY
IT432, ADVANCED COMPUTER AND NETWORK SECURITY
IT440, SYSTEMS ANALYSIS AND DESIGN
IT452, ADV WEB & INTERNET SYSTEMS
IT460, HUMAN COMPUTER INTERACTION
IT462, ADV DATABASE SYSTEMS
IT472, MOBILE OS DEVELOPMENT
IT484, ADVANCED TOPICS IN INFORMATION TECHNOLOGY
IT485, ADVANCED TOPICS IN INFORMATION TECHNOLOGY
IT485A, ADVANCED TOPICS IN INFORMATION TECHNOLOGY
IT485D, ADVANCED TOPICS IN INFORMATION TECHNOLOGY
IT485E, ADVANCED TOPICS IN INFORMATION TECHNOLOGY
IT486A, ADVANCED TOPICS IN INFORMATION TECHNOLOGY
IT486B, ADVANCED TOPICS IN INFORMATION TECHNOLOGY
IT486C, ADVANCED TOPICS IN INFORMATION TECHNOLOGY
IT486D, ADVANCED TOPICS IN INFORMATION TECHNOLOGY
IT486E, ADVANCED TOPICS IN INFORMATION TECHNOLOGY
IT486G, ADVANCED TOPICS IN INFORMATION TECHNOLOGY
IT486U, ADVANCED TOPICS IN INFORMATION TECHNOLOGY
IT495, INFO TECH RESEARCH PROJECT
IT495A, RESEARCH COURSE
IT495B, RESEARCH COURSE
IT592, TRIDENT SCHOLAR PROJECT
NE203, ETHICS AND MORAL REASONING FOR THE NAVAL LEADER
NE203A, ETHICS AND MORAL REASONING FOR THE NAVAL LEADER
NE203B, ETHICS AND MORAL REASONING FOR THE NAVAL LEADER
NE203C, ETHICS AND MORAL REASONING FOR THE NAVAL LEADER
NE203D, ETHICS AND MORAL REASONING FOR THE NAVAL LEADER
NE481, INDEPENDENT STUDY IN METAPHYSICS
NL102, FOUNDATIONS OF NAVAL CORE VALUES AND FUNDAMENTALS
NL110, PREPARING TO LEAD
NL112, LEADERSHIP AND HUMAN BEHAVIOR
NL112N, LEADERSHIP AND HUMAN BEHAVIOR
NL200, HUMAN BEHAVIOR
NL202, LEADERSHIP II
NL211, SOCIAL PSYCHOLOGY
NL212, PRINCIPLES OF SOCIOLOGICAL SOCIAL PSYCHOLOGY
NL230, INTRODUCTION TO SOCIOLOGY
NL285, TOPICS IN PSYCHOLOGY
NL285A, TOPICS IN PSYCHOLOGY
NL285B, TOPICS IN PSYCHOLOGY
NL286, TOPICS IN LEADERSHIP
NL286A, TOPICS IN PSYCHOLOGY
NL302, LEADERSHIP: THEORY AND APPL
NL303, LEADERSHIP: THEORY AND APPL
NL306, PERSONALITY
NL310, LEADERSHIP: THEORY AND APPLICATIONS
NL311, PSYCHOLOGY OF LEADERSHIP
NL312, ABNORMAL PSYCHOLOGY
NL313, THE PSYCHOLOGY OF CRIME
NL330, SOCIOLOGY OF MARRIAGE & FAMILIES
NL335, ARMED FORCES AND SOCIETY
NL340, CHANGE MANAGEMENT
NL360, CULTURE AND LEADERSHIP
NL400, LAW FOR THE JUNIOR OFFICER
NL401, JUNIOR OFFICER PRACTICUM (SURFACE)
NL402, JUNIOR OFFICER PRACTICUM (SUBMARINE)
NL403, JUNIOR OFFICER PRACTICUM (AVIATION)
NL404, JUNIOR OFFICER PRACTICUM (MARINE CORPS)
NL405, JUNIOR OFFICER PRACTICUM (SPECIAL WARFARE)
NL406, JUNIOR OFFICER PRACTICUM (STAFF CORPS)
NL420, COMMUNICATING AS A LEADER
NL425, ENGINEERING LEADERSHIP
NL430, LEADERSHIP IN GROUPS AND ORGANIZATIONS
NL435, MILITARY SOCIOLOGY
NL440, EXPERIENTIAL LEADERSHIP
NL445, GENDER MATTERS: THE SOCIOLOGY OF GENDER
NL450, SOCIAL INEQUALITY
NL484, ADVANCED TOPICS IN LEADERSHIP
NL485, ADVANCED TOPICS IN LEADERSHIP
NL485A, ADVANCED TOPICS IN LEADERSHIP
NL485B, ADVANCED TOPICS IN LEADERSHIP
NL485C, ADVANCED TOPICS IN LEADERSHIP
NL485D, ADVANCED TOPICS IN LEADERSHIP
NL485E, ADVANCED TOPICS IN LEADERSHIP
NL486, ADVANCED TOPICS IN LEADERSHIP
NL486A, ADVANCED TOPICS IN LEADERSHIP
NL486B, ADVANCED TOPICS IN LEADERSHIP
NL486C, ADVANCED TOPICS IN LEADERSHIP
NL486D, ADVANCED TOPICS IN LEADERSHIP
NL486E, ADVANCED TOPICS IN LEADERSHIP
NL486F, ADVANCED TOPICS IN LAW
NL486N, ADVANCED TOPICS IN LEADERSHIP
NL487, ADVANCED TOPICS IN LEADERSHIP
NL491, RESEARCH IN LEL
NL491A, RESEARCH IN LEL
NL495, RESEARCH IN PSYCHOLOGY
NL495A, INDEPENDENT STUDY IN LEL
NL495B, INDEPENDENT STUDY IN LEL
NL496, INDEPENDENT RESEARCH
NL496A, INDEPENDENT STUDY IN LEL
NL496B, INDEPENDENT STUDY IN LEL
NL496C, ADV TOPICS IN LEL
NL496N, INDEPENDENT RESEARCH IN LEL
NL496O, INDEPENDENT RESEARCH IN LEL
NN101, INTRODUCTION TO NAVIGATION
NN200, NAVIGATION AND PILOTING
NN204, NAVIGATION AND PILOTING
NN210, BASIC NAVIGATION
NN310, ADVANCED NAVIGATION
NN310L, ADVANCED NAVIGATION (LAB)
NP230, INTRODUCTION TO PHILOSOPHY
NP232, MILITARY ETHICS: THE CODE OF THE WARRIOR
NP240, PHILOSOPHY AT THE MOVIES
NP250, LOGIC AND CRITICAL THINKING
NP285, TOPICS IN PHILOSOPHY
NP286, TOPICS IN PHILOSOPHY
NP336, PHILOSOPHY OF RELIGION
NP340, PHILOSOPHY OF SCIENCE
NP410, PHILOSOPHY OF WAR
NP430, ETHICS AND IRREGULAR WARFARE
NP482, ADV TOPICS IN PHILOSOPHY
NP484, ADV TOPICS IN PHILOSOPHY
NP485, ADV TOPICS IN PHILOSOPHY
NP485A, ADV TOPICS IN PHILOSOPHY
NP485B, ADV TOPICS IN PHILOSOPHY
NP485C, ADV TOPICS IN PHILOSOPHY
NP485D, ADV TOPICS IN PHILOSOPHY
NP486, ADV TOPICS IN PHILOSOPHY
NP486A, ADV TOPICS IN PHILOSOPHY
NP486B, ADV TOPICS IN PHILOSOPHY
NP486C, ADV TOPICS IN PHILOSOPHY
NP492, PHILOSOPHY OF QUANTUM PH
NP494A, IND STUDY IN PHILOSOPHY
NP496, ETHICS & LEADERSHIP: FOUNDATIONS OF MILITARY PROF
NP496A, IND RESEARCH IN PHILOSOPHY
NS100, FUNDAMENTALS OF NAVAL SCIENCE
NS100N, FUNDAMENTALS OF NAVAL SCIENCE
NS101, FUNDAMENTALS OF SEAMANSHIP
NS300, NAVAL WARFARE
NS300A, NAVAL WARFARE
NS300B, NAVAL WARFARE
NS310, STRATEGY AND TACTICS
NS311, NETWORK-CENTRIC WARFARE
NS401, JUNIOR OFFICER PRACTICUM (SURFACE)
NS402, JUNIOR OFFICER PRACTICUM (SUBMARINE)
NS403, JUNIOR OFFICER PRACTICUM (AVIATION)
NS404, JUNIOR OFFICER PRACTICUM (MARINE CORPS)
NS405, JUNIOR OFFICER PRACTICUM (SPEC WAR)
NS405A, JO PRACTICUM (SUPPLY)
NS405B, JO PRACTICUM (SPEC WAR)
NS405C, JO PRACTICUM (MEDICAL)
NS405D, JO PRACTICUM (ARMY)
NS405E, JO PRACTICUM (CEC)
NS405G, JO PRACTICUM (AIR FORCE)
NS406, JUNIOR OFFICER PRACTICUM (STAFF CORPS)
NS410, NETWORK CENTRIC WARFARE
NS421, JO PRACTICUM (SURFACE WARFARE)
NS421A, JO PRACTICUM (EOD)
NS422, JO PRACTICUM (SUBMARINE WARFARE)
NS423, JO PRACTICUM (NAVAL AVIATION)
NS424, JO PRACTICUM (MARINE CORPS)
NS425, JO PRACTICUM (SPECIAL WARFARE)
NS426, JO PRACTICUM (EOD)
NS427, JO PRACTICUM (RESTRICTED LINE & STAFF CORPS)
NS427I, JO PRACTICUM (IDC)
NS427M, JO PRACTICUM (MEDICAL CORPS)
NS427S, JO PRACTICUM (SUPPLY CORPS)
NS431, JO PRACTICUM (SURFACE)
NS432, JO PRACTICUM (SUBMARINES)
NS433, JO PRACTICUM (AVIATION)
NS434, JO PRACTICUM (USMC)
NS435, JO PRACTICUM (SPECWAR)
NS436, JO PRACTICUM (EOD)
NS437I, JO PRACTICUM (IDC)
NS437M, JO PRACTICUM (MEDICAL CORPS)
NS437S, JO PRACTICUM (SUPPLY CORPS)
NS485, ADV TOPICS IN SEAMANSHIP & NAVIGATION
NS486, ADV TOPICS IN SEAMANSHIP & NAVIGATION
PE101, PHYSICAL EDUCATION-BOXING/WRESTLING
PE102, PHYSICAL EDUCATION-SWIMMING
PE111, PHYSICAL EDUCATION-BOXING/WRESTLING
PE201, PHYSICAL EDUCATION-SWIMMING
PE202, PHYSICAL EDUCATION-MARTIAL ARTS I
PE212, PHYSICAL EDUCATION (WOMEN)
PE299S, 3RD CLASS M/PE
PE301, PHYSICAL EDUCATION-SWIMMING & PERS COND/WELLNESS
PE302, PHYSICAL EDUCATION-MARTIAL ARTS II
PE322, KAYAKING
PE323, GYMNASTICS
PE324, TENNIS
PE326, VOLLEYBALL
PE327, GOLF
PE328, SQUASH
PE329, FIRST AID
PE330, WT TRAINING
PE331, RACQUETBALL
PE332, BASKETBALL
PE333, BADMINTON
PE334, WATER POLO
PE335, LACROSSE
PE336, SOFTBALL
PE338, BOXING AEROBICS
PE339, SOCCER
PE340, SWIM CONDITIONING
PE350, INTRODUCTION TO CLIMBING
PE354, ADVENTURE CHALLENGE
PE399F, 2RD CLASS M/PE
PE399S, 2ND CLASS M/PE
PE399T, 2ND CLASS M/PE
PE401, HAND-TO-HAND
PE402, KAYAKING
PE403, GYMNASTICS
PE404, TENNIS
PE405, FITNESS
PE406, VOLLEYBALL
PE407, GOLF
PE408, SQUASH
PE409, FIRST AID
PE410, WEIGHT TRAINING
PE411, RACQUETBALL
PE412, BASKETBALL
PE413, BADMINTON
PE414, WATER POLO
PE415, LACROSSE
PE416, SOFTBALL
PE417, ROWING
PE418, ADVANCED BOXING
PE419, SOCCER
PE420, SWIMMING CONDITIONING
PE421, FITNESS TESTING AND ASSESSMENT
PE422, KAYAKING
PE423, SERVICE ASSIGNMENT TRAINING: SWIM (NAVAL AVIATION)
PE424, SERVICE ASSIGNMENT TRAINING: COMBATIVE (USMC)
PE425, FITNESS
