DM201C, MGSP-LEADERS (CHEMISTRY)
DM201E, MGSP-LEADERS (ENGINEERING)
DM201F, MGSP-LEADERS (SOCIAL SCIENCES)
DM201I, MGSP-LEADERS (COMPSCI)
DM201M, MGSP-LEADERS (MATHEMATICS)
DM201P, MGSP-LEADERS (PHYSICS)
DM201S, MGSP-LEADERS (ENGINEERING)
DM202C, MGSP-LEADERS (CHEMISTRY)
DM202D, MGSP-LEADERS (DYNAMICS)
DM202E, MGSP-LEADERS (ENGINEERING)
DM202I, MGSP-LEADERS (COMPSCI)
DM202M, MGSP-LEADERS (MATHEMATICS)
DM202P, MGSP-LEADERS (PHYSICS)
DM212, MGSP-STAFF
DM212C, MGSP-LEADERS (CHEMISTRY)
DM212E, MGSP-LEADERS (ENGINEERING)
DM212F, MGSP - LEADERS (SOCIAL SCIENCES)
DM212I, MGSP-LEADERS (COMPUTER SCIENCE)
DM212L, MGSP-LEADERS (LANGUAGE)
DM212M, MGSP-LEADERS (MATHEMATICS)
DM212N, MGSP-LEADERS (NAVIGATION)
DM212P, MGSP-LEADERS (PHYSICS)
DM212S, MGSP - LEADERS (ENGINEERING)
DM301, MGSP-LEADERS
DM301C, MGSP-LEADERS (CHEMISTRY)
DM301E, MGSP-LEADERS (ENGINEERING)
DM301F, MGSP - LEADERS (SOCIAL SCIENCES)
DM301I, MGSP-LEADERS (COMPUTER SCIENCE)
DM301L, MGSP-LEADERS (LANGUAGE)
DM301M, MGSP-LEADERS (MATHEMATICS)
DM301N, MGSP-LEADERS (NAVIGATION)
DM301P, MGSP-LEADERS (PHYSICS)
DM301S, MGSP-LEADERS (ENGINEERING)
DM302C, MGSP-MENTORS (CHEMISTRY)
DM302D, MGSP-MENTORS (DYNAMICS)
DM302E, MGSP-MENTORS (ENGINEERING)
DM302I, MGSP-MENTORS (COMPUTER SCIENCE)
DM302M, MGSP-MENTORS (MATHEMATICS)
DM302P, MGSP-MENTORS (PHYSICS)
DM401C, MGSP-LEADERS (CHEMISTRY)
DM401E, MGSP-LEADERS (ENGINEERING)
DM401M, MGSP-LEADERS (MATHEMATICS)
DM401P, MGSP-LEADERS (PHYSICS)
DM401S, MGSP-LEADERS (ENGINEERING)
DM402C, MGSP-SUPERVISORS (CHEMISTRY)
DM402D, MGSP-SUPERVISORS (DYNAMICS)
DM402E, MGSP-SUPERVISORS (ENGINEERING)
DM402M, MGSP-SUPERVISORS (MATHEMATICS)
DM402P, MGSP-SUPERVISORS (PHYSICS)
EA202, PRINCIPLES OF FLIGHT
EA203, PRINCIPLES OF AEROSPACE ENGINEERING I
EA204, PRINCIPLES OF AEROSPACE ENGINEERING II
EA205, PRINCIPLES OF AERONAUTICS AND ASTRONAUTICS
EA221, ENGINEERING MECHANICS FOR AEROSPACE ENGINEERING
EA222, MATERIALS FOR AEROSPACE ENGINEERS
EA232, DYNAMICS IN AEROSPACE ENGINEERING
EA300, INTRODUCTION TO AERONAUTICS
EA301, AERODYNAMICS
EA303, WIND TUNNEL
EA304, AERODYNAMICS II
EA305, AERO/GAS DYNAMICS
EA305L, AERO/GAS DYNAMICS - LAB ONLY
EA307, ENGINEERING ANALYSIS
EA308, ENGINEERING ANALYSIS
EA322, STRUCTURES FOR AEROSPACE ENG
EA322L, STRUCTURES FOR AEROSPACE ENG (LAB ONLY)
EA332, GAS DYNAMICS
EA361, INTRO TO SPACE
EA362, ASTRODYNAMICS I
EA362A, ASTRODYNAMICS I (ASTRO)
EA364, SPACECRAFT ATTITUDE DYNAMICS & CONTROL
EA365, ROCKET PROPULSION
EA400, INTRODUCTION TO AERONAUTICS
EA401, AIRCRAFT PERFORMANCE & DESIGN
EA401F, PERFORMANCE AND DESIGN OF FIXED-WING AIRCRAFT
EA401R, PERFORMANCE AND DESIGN OF ROTARY-WING AIRCRAFT
EA413, STABILITY AND CONTROL
EA413F, STABILITY AND CONTROL: FIXED-WING
EA413R, STABILITY AND CONTROL: ROTOR
EA414, AIRPLANE SIMULATION AND CONTROL
EA417, ELEMENTS OF FLIGHT TEST ENGINEERING
EA421, AEROSPACE STRUCTURES II
EA424, STRUCTURAL DYNAMICS
EA425, VISCOUS FLOW
EA427, AERODYNAMICS III
EA428, COMPUTATIONAL AERODYNAMICS
EA429, FLIGHT PROPULSION
EA430, PROPULSION II
EA435, THE AERODYNAMICS OF V/STOL AIRCRAFT
EA439, SPECIAL AIRCRAFT DESIGN
EA440, AEROSPACE VEHICLE DESIGN
EA450, COMPUTER AIDED DESIGN
EA461, SPACE ENVIRONMENT
EA462, ASTRODYNAMICS II
EA463, SPACE OPERATIONS
EA464, ATTITUDE DYN & CNTRL
EA465, SPACECRAFT COMMUNICATIONS AND POWER
EA466, SPACECRAFT THERMAL CONTROL
EA467, SPACECRAFT SYSTEM LABORATORY
EA469, SPECIAL SPACE CRAFT DESIGN
EA470, SPACECRAFT DESIGN
EA482, ADVANCED TOPICS IN AEROSPACE ENGINEERING
EA483, ADVANCED TOPICS IN AEROSPACE ENGINEERING
EA485, ADVANCED TOPICS IN AEROSPACE ENGINEERING
EA485A, ADVANCED TOPICS IN AEROSPACE ENGINEERING
EA485F, ADVANCED TOPICS IN AEROSPACE ENGINEERING
EA486, ADVANCED TOPICS IN AEROSPACE ENGINEERING
EA486A, ADVANCED TOPICS IN AEROSPACE ENGINEERING
EA486B, ADVANCED TOPICS IN AEROSPACE ENGINEERING
EA486C, ADVANCED TOPICS IN AEROSPACE ENGINEERING
EA486D, ADVANCED TOPICS IN AEROSPACE ENGINEERING
EA486E, ADVANCED TOPICS IN AEROSPACE ENGINEERING
EA486F, ADVANCED TOPICS IN AEROSPACE ENGINEERING
EA486G, ADVANCED TOPICS IN AEROSPACE ENGINEERING
EA486J, ADVANCED TOPICS IN AEROSPACE ENGINEERING
EA486K, ADVANCED TOPICS IN AEROSPACE ENGINEERING
EA486L, ADVANCED TOPICS IN AEROSPACE ENGINEERING
EA488A, ADVANCED TOPICS IN AEROSPACE ENGINEERING
EA495, AERO ENG RES/DES
EA496, AERO ENG RES DES
EA581, TRIDENT SCHOLAR PROJECT
EA582, TRIDENT SCHOLAR PROJECT
EA583, TRIDENT SCHOLAR PROJECT
EA588, TRIDENT SCHOLAR PROJECT
EA589, TRIDENT SCHOLAR PROJECT
EA590, TRIDENT SCHOLAR PROJECT
EA591, TRIDENT SCHOLAR PROJECT
EA592, TRIDENT SCHOLAR PROJECT
EC244, ELECTRONICS/ELECTROMECHANICS
EC262, DIGITAL SYSTEMS
EC310, APPLICATIONS OF CYBER ENGINEERING
EC312, APPLICATIONS OF CYBER ENGINEERING FOR SYSTEMS ENG
EC356, COMPUTER NETWORKS WITH SECURITY APPLICATIONS
EC361, MICROCOMPUTER-BASED DESIGN
EC362, COMPUTER ARCHITECTURE
EC404, OPERATING SYSTEMS
EC415, COMPUTER ENG DESIGN II
EC436, INTRO COMPUTER NETWORKS
EC456, WIRELESS NETWORKS
EC463, MICROCOMPUTER INTERFACING
EC481, ADV TOPICS IN COMPUTER ENGR
EC482, ADV TOPICS IN COMPUTER ENGR
EC485E, COMPUTER AND NETWORK SECURITY FUNDAMENTALS
EC486A, ADV TOPICS IN COMPUTER ENGR
EC488A, ADV TOPICS IN COMPUTER ENGR
EC488B, ADV TOPICS IN COMPUTER ENGR
EC495, COMPUTER ENGR RESEARCH
EC496, COMPUTER ENGR RESEARCH
EE221, INTRODUCTION TO ELECTRICAL ENGINEERING I
EE226, CIRCUIT ANALYSIS
EE228, INTRODUCTION TO ELECTRICAL ENGINEERING II
EE232, CIRCUIT ANALYSIS
EE241, ELECTRONICS I
EE242, DIGITAL SYSTEMS
EE300, INTRODUCTION TO FUNDAMENTAL ELECTRICAL TECHNOLOGY
EE301, ELECTRICAL FUND AND APPL
EE301L, ELECTRICAL FUND AND APPL - LAB
EE302, ELECTRONIC COMM SYS AND DIGITAL COMM
EE302A, ELECTRONIC COMM SYS AND DIGITAL COMM (CS/IT ONLY)
EE303, DIGITAL COMMUNICATIONS
EE311, ELECTRICAL FUNDAMENTALS AND APPLICATIONS I
EE312, ELECTRICAL FUNDAMENTALS AND APPLICATIONS II
EE313, LOGIC DESIGN AND MICROPROCESSORS
EE320, INTRO TO ELECTRICAL ENGR II
EE322, SIGNALS AND SYSTEMS
EE322N, SIGNALS AND SYSTEMS
EE331, ELECTRICAL ENGINEERING I
EE331L, ELECTRICAL ENGINEERING I - LAB
EE332, ELECTRICAL ENGINEERING II
EE334, ELECTRICAL ENGR AND IT SYSTEMS
EE341, ELECTRONICS I
EE342, ELECTRONICS II
EE344, SOLID-STATE POWER ELECTRONICS
EE353, PROB STATS & LIN ALG FOR ECE
EE354, MODERN COMM SYSTEMS WITH CYBER APPLICATIONS
EE361, MICROCOMPUTER-BASED DESIGN
EE362, COMPUTER ARCHITECTURE
EE372, ENGINEERING ELECTROMAGNETICS
EE411, ELECT & COMP ENG DESIGN I
EE412, ELECTRICAL ENGR DESIGN II
EE414, ELECTRICAL ENG DESIGN II
EE415, COMPUTER ENG DESIGN II
EE420, ELECTRIC MACHINES AND DRIVES
EE421, ENERGY CONVERSION
EE422, MACHINE CONTROL
EE423, ELECTRICAL ENGR DESIGN
EE426, FUNDAMENTALS OF ELECTRONIC INSTRUMENTATION
EE431, ADVANCED COMMUNICATION THEORY
EE432, DIGITAL SIGNAL PROCESSING
EE432L, DIGITAL SIGNAL PROCESSING LAB
EE433, WIRELESS AND CELLULAR COMMUNICATIONS SYSTEMS I
EE434, WIRELESS AND CELLULAR COMMUNICATIONS SYSTEMS II
EE435, BIOMETRIC SIGNAL PROCESSING
EE451, ELECTRONIC PROPERTIES OF SEMICONDUCTORS
EE452, SEMICONDUCTOR ELECTRONICS
EE461, MICROCOMPUTER-BASED DIGITAL DESIGN
EE462, MICROCOMPUTER INTERFACING
EE464, INTRODUCTION TO COMPUTER NETWORKS
EE471, RF POWER ELECTRONICS
EE472, FIBER OPTICAL COMMUNICATIONS
EE482, ADVANCED TOPICS IN ELECTRICAL ENGR
EE482A, ADVANCED TOPICS IN ELECTRICAL ENGR
EE485A, ADVANCED TOPICS IN ELECTRICAL ENGR
EE485F, ADVANCED TOPICS IN ELECTRICAL ENGR
EE485G, ADVANCED TOPICS IN ELECTRICAL ENGR
EE485I, ADVANCED TOPICS IN ELECTRICAL ENGR
EE485S, ADVANCED TOPICS IN ELECTRICAL ENGR
EE486, ADVANCED TOPICS IN ELECTRICAL ENGR
EE486A, ADVANCED TOPICS IN ELECTRICAL ENGR
EE486C, ADVANCED TOPICS IN ELECTRICAL ENGR
EE486D, ADVANCED TOPICS IN ELECTRICAL ENGR
EE486E, ADVANCED TOPICS IN ELECTRICAL ENGR
EE486F, ADVANCED TOPICS IN ELECTRICAL ENGR
EE487, ADVANCED TOPICS IN ELECTRICAL ENGR
EE487A, ADVANCED TOPICS IN ELECTRICAL ENGR
EE487B, ADVANCED TOPICS IN ELECTRICAL ENGR
EE488, ADVANCED TOPICS IN ELECTRICAL ENGR
EE488A, ADVANCED TOPICS IN ELECTRICAL ENGR
EE488B, ADVANCED TOPICS IN ELECTRICAL ENGR
EE488C, ADVANCED TOPICS IN ELECTRICAL ENGR
EE491, ELECTRICAL ENGR RESEARCH
EE492, ELECTRICAL ENGR RESEARCH
EE493, ELECTRICAL ENGR  RESEARCH
EE494, ELECTRICAL ENGR RESEARCH
EE495, ELECTRICAL ENGR RESEARCH
EE496, ELECTRICAL ENGR RESEARCH
EE497, INDEPENDENT RESEARCH
EE581, TRIDENT SCHOLAR PROJECT
EE582, TRIDENT SCHOLAR PROJECT
EE583, TRIDENT SCHOLAR PROJECT
EE584, TRIDENT SCHOLAR PROJECT
EE588, TRIDENT SCHOLAR PROJECT
EE589, TRIDENT SCHOLAR PROJECT
EE590, TRIDENT SCHOLAR PROJECT
EE591, TRIDENT SCHOLAR PROJECT
EE592, TRIDENT SCHOLAR PROJECT
EG471, ENGINEERING DESIGN I
EG472, ENGINEERING DESIGN II
EM205, INTRODUCTION TO MECHANICAL ENGINEERING
EM211, STATICS
EM211A, STATICS
EM214, ELEMENTS OF MATERIALS SCIENCE
EM215, INTRODUCTION TO MECHANICAL ENGINEERING
EM217, STRENGTH OF MATERIALS
EM217L, STRENGTH OF MATERIALS LAB
EM221, MECHANICS FOR NUCLEAR ENGINEERING
EM232, DYNAMICS
EM232A, DYNAMICS
EM282, FLUID DYNAMICS LAB
EM300, PRINCIPLES OF PROPULSION
EM300L, PRINCIPLES OF PROPULSION - LAB
EM300N, PRINCIPLES OF PROPULSION/NUCLEAR
EM313, MATERIALS SCIENCE
EM313L, MATERIALS SCIENCE LAB
EM316, THERMO-FLUID SCIENCES I
EM317, THERMO-FLUID SCIENCES II
EM317L, THERMO-FLUID SCIENCES II - LAB
EM318, APPLIED FLUID MECHANICS
EM319, ENGINEERING THERMODYNAMICS
EM319A, ENGINEERING THERMODYNAMICS
EM320, APPLIED THERMODYNAMICS
EM320L, APPLIED THERMODYNAMICS - LAB
EM321, MECHANICS/MATERIALS FOR AERO
EM321L, MECHANICS & MATERIALS FOR AERO ENG
EM324, FLUID DYNAMICS
EM324L, FLUID DYNAMICS LAB
EM327, FLUID DYNAMICS
EM362, REACTOR PHYSICS I
EM371, INTRODUCTION TO DESIGN
EM375, MECHANICAL ENGINEERING EXPERIMENTATION
EM380, ENGINEERING REVIEW
EM411, HEAT TRANSFER
EM415, HEAT TRANSFER
EM415L, HEAT TRANSFER LAB
EM417, INTERMEDIATE MECHANICS OF MATERIALS
EM420, PROJECT MANAGEMENT MECH ENG
EM423, MECHANICAL VIBRATIONS
EM424, ANALYTICAL METHODS MECHANICS
EM432, COMPUTER METHODS IN STRUCTURAL MECHANICS
EM433, COMPUTER-AIDED MANUFACTURING
EM436, MECHANICS OF COMPOSITE STRUC
EM441, DIRECTED ENERGY WEAPONS
EM442, COMPUTER-AIDED THERMODYNAMICS
EM443, ENERGY CONVERSION
EM444, SOLAR ENGINEERING
EM445, NONDESTRUCTIVE EVALUATION
EM446, "HEATING,  VENTILATION AND AIR CONDITIONING:  DESIGN"
EM447, WIND AND TIDAL ENERGY
EM450, COMPRESSIBLE FLOW AND TURBOMACHINERY
EM451, DESIGN OF ROBOTIC ELEMENTS
EM452, ENGINEERING MATERIALS
EM453, MATERIALS: PROCESSING & FABRICATION
EM454, MECHANICAL BEHAVIOR OF MATERIALS
EM456, CORROSION AND CORROSION CONTROL
EM458, FAILURE ANALYSIS
EM461, "ENGINES:  PRINCIPLES,  DESIGN AND APPLICATIONS"
EM463, REACTOR PHYSICS II
EM468, NUCLEAR ENERGY CONVERSION
EM471, MECHANICAL ENGINEERING DESIGN I
EM471A, MECH ENGR EXPERIMENTATION
EM471B, MECH ENGR EXPERIMENTATION
EM472, MECHANICAL ENGINEERING DESIGN II
EM474, GAS TURBINES: DESIGN AND ANALYSIS
EM475, MOTORSPORTS ENGINEERING
EM476, UNDERSEA POWER SYSTEMS
EM477, COMPUTER-AIDED DESIGN
EM482, ADVANCED TOPICS IN MECHANICAL ENGINEERING
EM482L, ADVANCED TOPICS IN MECHANICAL ENGINEERING
EM485, ADVANCED TOPICS IN MECHANICAL ENGINEERING
EM485A, ADVANCED TOPICS IN MECHANICAL ENGINEERING
EM485B, ADVANCED TOPICS IN MECHANICAL ENGINEERING
EM485C, ADVANCED TOPICS IN MECHANICAL ENGINEERING
EM485D, ADVANCED TOPICS IN MECHANICAL ENGINEERING
EM485E, ADVANCED TOPICS IN MECHANICAL ENGINEERING
EM485F, ADVANCED TOPICS IN MECHANICAL ENGINEERING
EM485G, ADVANCED TOPICS IN MECHANICAL ENGINEERING
EM485H, ADVANCED TOPICS IN MECHANICAL ENGINEERING
EM485R, ADVANCED TOPICS IN MECHANICAL ENGINEERING
EM486, ADVANCED TOPICS IN MECHANICAL ENGINEERING
EM486A, ADVANCED TOPICS IN MECHANICAL ENGINEERING
EM486B, ADVANCED TOPICS IN MECHANICAL ENGINEERING
EM486C, ADVANCED TOPICS IN MECHANICAL ENGINEERING
EM486D, ADVANCED TOPICS IN MECHANICAL ENGINEERING
EM486E, ADVANCED TOPICS IN MECHANICAL ENGINEERING
EM486F, ADVANCED TOPICS IN MECHANICAL ENGINEERING
EM486H, ADVANCED TOPICS IN MECHANICAL ENGINEERING
EM486I, ADVANCED TOPICS IN MECHANICAL ENGINEERING
EM486J, ADVANCED TOPICS IN MECHANICAL ENGINEERING
EM486K, ADVANCED TOPICS IN MECHANICAL ENGINEERING
EM491, MECH ENGR RES OR DES PROJ
EM492, MECH ENGR RES OR DES PROJ
EM493, MECH ENGR RES OR DES PROJ
EM494, MECH ENGR RES OR DES PROJ
EM495, MECH ENGR RES OR DES PROJ
EM496, MECH ENGR RES OR DES PROJ
EM499, MECH ENGR RES OR DES PROJ
EM583, TRIDENT SCHOLAR PROJECT
EM589, TRIDENT SCHOLAR PROJECT
EM590, TRIDENT SCHOLAR PROJECT
EM591, TRIDENT SCHOLAR PROJECT
EM592, TRIDENT SCHOLAR PROJECT
EN200, PRINCIPLES OF SHIP PERFORMANCE
EN221, ENGR MECH W/MARINE APPS I
EN222, ENGR MECH W/MARINE APPS II
EN245, PRINCIPLES OF OCEAN SYSTEMS ENGINEERING
EN245A, PRINCIPLES OF OCEAN SYSTEMS ENGINEERING
EN246, PRINCIPLES OF NAVAL ARCHITECTURE
EN247, PRINCIPLES OF NAVAL ARCH & MARINE ENGR
EN275, OCEAN MEASUREMENT & ANALYSIS
EN285, TOPICS IN NAVAL ARCH & OCEAN ENGN
EN286, TOPICS IN NAVAL ARCH & OCEAN ENGN
EN300, NAVAL ENGINEERING II
EN330, PROBS & STATS W/ OCEAN APPLS
EN342, SHIP HYDROSTATICS AND STABILITY
EN353, RESISTANCE AND PROPULSION
EN358, SHIP STRUCTURES
EN361, MARINE POWER SYSTEMS
EN362, REACTOR PHYSICS I
EN366, COMPUTER METHODS IN POWER ENGINEERING
EN380, NAVAL MATERIALS SCIENCE AND ENGINEERING
EN400, PRINCIPLES OF SHIP PERFORMANCE
EN400L, PRINCIPLES OF SHIP PERFORMANCE - LAB
EN401, ENGINEERING IN THE LITTORAL ZONE
EN401L, ENGINEERING IN THE LITTORAL ZONE - LAB EXCHANGE
EN405, NAVAL APPL OF THERMO
EN411, OCEAN ENVIRONMENTAL ENGINEERING I
EN412, OCEAN ENVIRONMENTAL ENGINEERING II
EN420, COASTAL ENGINEERING
EN425, OCEAN THERMAL SYSTEMS
EN426, PORT AND HARBOR ENGINEERING
EN430, UNDERWATER WORK SYSTEMS
EN431, MARINE ENGINEERING SYSTEMS
EN440, DESIGN OF FOUNDATIONS FOR OCEAN STRUCTURES
EN441, OCEAN ENGINEERING STRUCTURES I
EN442, OCEAN ENG STRUCTURES II
EN443, MARINE ENGINEERING DESIGN I
EN445, MARINE FABRICATION METHODS
EN447, AUTONOMOUS VESSEL DESIGN
EN448, AUTONOMOUS VESSEL FAB & EVAL
EN450, ENGINEERING ECONOMIC ANALYSIS
EN452, STRUCTURAL RELIABILITY
EN454, PROJ MGMT FOR OCEAN ENGRS
EN455, SEAKEEPING AND MANEUVERING
EN456, ADVANCED METHODS IN SHIP DESIGN
EN457, HYDROFOIL AND PROPELLER DESIGN
EN458, ADVANCED MARINE VEHICLES
EN458H, ADVANCED MARINE VEHICLES (HONORS)
EN460, MARINE ENGINEERING DESIGN II
EN461, OCEAN SYSTEMS ENGINEERING DESIGN I
EN462, OCEAN SYSTEMS ENGINEERING DESIGN II
EN462C, OCEAN SYS ENGR DESIGN
EN462U, OCEAN SYS ENGR DESIGN
EN463, REACTOR PHYSICS II
EN465, ADV MARINE POWER SYST
EN467, THERMAL ENGINEERING *
EN468, NUCLEAR ENERGY CONVERSION
EN470, LIFE SUPPORT SYSTEMS
EN471, SHIP DESIGN I
EN472, GAS TURBINES:  DESIGN AND ANALYSIS
EN475, OCEAN ENGINEERING MECHANICS
EN476, SHIP DESIGN II
EN477, UNDERSEA POWER SYSTEMS
EN478, SUBMARINE & SUBMERSIBLE DESIGN
EN481, ADVANCED TOPICS IN NAVAL ENGINEERING
EN481A, ADVANCED TOPICS IN NAVAL ENGINEERING
EN481B, ADVANCED TOPICS IN NAVAL ENGINEERING
EN481H, ADVANCED TOPICS IN NAVAL ARCHITECTURE
EN482, ADVANCED TOPICS IN NAVAL ENGINEERING
EN482G, EOE DESIGN SEMINAR
EN482H, SP READINGS IN NAVAL ARCH
EN482O, ADVANCED TOPICS IN NAVAL ENGINEERING
EN482U, TOPICS IN NAVAL ARCHITECURE
EN482X, NAVAL ENGINEERING I LAB
EN484, ADVANCED TOPICS IN NAVAL ENGINEERING
EN485A, ADVANCED TOPICS IN NAVAL ENGINEERING
EN485B, ADVANCED TOPICS IN NAVAL ENGINEERING
EN485C, ADVANCED TOPICS IN NAVAL ENGINEERING
EN485M, ADVANCED TOPICS IN NAVAL ENGINEERING
EN485N, SPECIAL TOPICS IN NAVAL ARCHITECTURE
EN485O, SPECIAL TOPICS IN OCEAN ENGINEERING
EN486, ADVANCED TOPICS IN NAVAL ENGINEERING
EN486A, ADVANCED TOPICS IN NAVAL ENGINEERING
EN486B, ADVANCED TOPICS IN NAVAL ENGINEERING
EN486C, ADVANCED TOPICS IN NAVAL ENGINEERING
EN486D, ADVANCED TOPICS IN NAVAL ENGINEERING
EN486E, ADVANCED TOPICS IN NAVAL ENGINEERING
EN486F, ENVIR ISSUES IN OCEAN I
EN486G, ADVANCED TOPICS IN NAVAL ENGINEERING
EN486H, ADVANCED STRUCT FOR OCEAN
EN486I, GREEN SHIP ENVIRN SYST
EN486J, HUMAN POWERED SUB DESGN
EN486L, ADVANCED TOPICS IN NAVAL ENGINEERING
EN486M, ADVANCED TOPICS IN NAVAL ENGINEERING
EN486N, SPECIAL TOPICS IN NAVAL ARCHITECTURE
EN486O, SPECIAL TOPICS IN NAVAL ARCHITECTURE
EN491, NAVAL ENGR RES DESIGN PROJ
EN492, NAVAL ENGR RES DESIGN PROJ
EN493, NAVAL ENGR RES DESIGN PROJ
EN494, NAVAL ENGR RES DESIGN PROJ
EN495, NAVAL ENGR RES DESIGN PROJ
EN496, NAVAL ENGR RES DESIGN PROJ
EN497, INDEPENDENT RESEARCH
EN503H, HONORS SENIOR THESIS 1
EN504H, HONORS SENIOR THESIS 2
EN583, TRIDENT SCHOLAR PROJECT
EN589, TRIDENT SCHOLAR PROJECT
EN590, TRIDENT SCHOLAR PROJECT
EN592, TRIDENT SCHOLAR PROJECT
ER301, FUNDAMENTALS OF NUCLEAR ENGINEERING
ER313, NUCLEAR MATERIAL SCIENCE
ER362, REACTOR PHYSICS
ER371, NUCLEAR PLANT DESIGN
ER463, RADIATION ENGINEERING
ER468, NUCLEAR PLANT ENGINEERING
ER482, TOPICS IN NUCLEAR ENGINEERING
ER485A, ADVANCED TOPICS IN NUCLEAR ENGINEERING
ER486A, ADVANCED TOPICS IN NUCLEAR ENGINEERING
ER591, TRIDENT SCHOLAR PROJECT
ER592, TRIDENT SCHOLAR PROJECT
ES200, INTRO TO SYSTEMS ENGINEERING
ES201, INTRO TO SYSTEMS ENGINEERING
ES202, PRINCIPLES OF MECHATRONICS
ES282, TOPICS IN SYSTEMS ENGINEERING
ES300, NAVAL WEAPONS SYSTEMS
ES301, SYSTEM MODELING AND SIMULATION
ES301L, SYSTEM MODELING AND SIMULATION - LAB
ES302, APPLIED CONTROL SYSTEMS AND INSTRUMENTATION
ES303, LINEAR CONTROL SYSTEMS
ES303H, HONORS LINEAR CONTROL SYSTEMS
ES304, MODERN CONTROL SYSTEMS
ES304H, HONORS MODERN CONTROL SYS
ES305, LINEAR CONTROL SYSTEMS
ES305H, HONORS LINEAR CONTROL SYSTEMS
ES305L, LINEAR CONTROL SYSTEMS - LAB
ES306, ADVANCED CONTROL SYSTEMS
ES306H, HONORS ADV CONTROL SYSTEMS
ES307, LINEAR CONTROL SYSTEMS
ES308, CONTROL SYSTEMS DESIGN LABORATORY
ES309, GUIDED DESIGN EXPERIENCE
ES310, INTRODUCTION TO WEAPONS SYSTEMS
ES320L, WEAPONS SYSTEMS LABORATORY SUPPLEMENT
ES321L, CONTROL SYSTEMS LABORATORY
ES360, CONTROL SYSTEMS LABORATORY
ES360A, CONTROL SYSTEMS LABORATORY
ES400, WEAPONS SYSTEMS ENGR
ES401, ENGINEERING DESIGN METHODS
ES402, SYSTEMS ENGINEERING DESIGN
ES403, ENGINEERING DESIGN METHODS
ES404, ENGINEERING DESIGN METHODS
ES405, APPLIED SENSORS AND ACTUATORS
ES410, CONTROL SYSTEMS AND THEIR APPLICATION TO WEAPONS
ES410L, CONTROL SYSTEMS & THEIR APPL TO WEAPONS (LAB)
ES413, DIGITAL CONTROL SYSTEMS
ES415, NONLINEAR CONTROL SYSTEMS
ES418, OPTIMAL CONTROL & ESTIMATION
ES419, WEAPONS SYSTEM ENGINEERING
ES420, WEAPONS SYSTEM ENGINEERING
ES421, INTRO TO COMM & INFO SYSTEMS
ES422, MODERN COMM & INFO SYSTEMS
ES430, EMBEDDED MICROCONTROLLER SYS
ES432, EMBEDDED MICROCONTROLLER APPLICATIONS
ES440, ENVIRONMENTAL SYSTEMS ENGINEERING
ES450, INTRODUCTION TO ROBOTIC SYSTEMS
ES451, MOBILE ROBOT DESIGN
ES452, ADVANCED TOPICS IN ROBOTICS
ES453, INTRO TO COMPUTER VISION
ES456, AUTONOMOUS VEHICLES
ES461, QUANTITATIVE METHODS FOR MANAGEMENT
ES462, EMERGING TECHNOLOGIES
ES464, SURVEY OF ENGINEERING ECONOMICS
ES470, DESKTOP MANUFACTURING AND PRODUCT DESIGN
ES481, ADVANCED TOPICS IN SYSTEMS ENGINEERING
ES481A, ADVANCED TOPICS IN SYSTEM ENGINEERING
ES481B, ADVANCED TOPICS IN SYSTEMS ENGINEERING
ES482, ADVANCED TOPICS IN SYSTEMS ENGINEERING
ES482B, ADVANCED TOPICS IN SYSTEMS ENGINEERING
ES484B, ADVANCED TOPICS IN SYSTEMS ENGINEERING
ES485, ADVANCED TOPICS IN SYSTEMS ENGINEERING
ES485A, ADVANCED TOPICS IN SYSTEMS ENGINEERING
ES485B, ADVANCED TOPICS IN SYSTEMS ENGINEERING
ES485C, ADVANCED TOPICS IN SYSTEMS ENGINEERING
ES485E, ADVANCED TOPICS IN SYSTEMS ENGINEERING
ES485F, ADVANCED TOPICS IN SYSTEMS ENGINEERING
ES485G, ADVANCED TOPICS IN SYSTEMS ENGINEERING
ES485H, ADVANCED TOPICS IN SYSTEMS ENGINEERING
ES486, ADVANCED TOPICS IN SYSTEMS ENGINEERING
ES486A, ADVANCED TOPICS IN SYSTEMS ENGINEERING
ES486B, ADVANCED TOPICS IN SYSTEMS ENGINEERING
ES486D, ADVANCED TOPICS IN SYSTEMS ENGINEERING
ES486E, ADVANCED TOPICS IN SYSTEMS ENGINEERING
ES486F, ADVANCED TOPICS IN SYSTEMS ENGINEERING
ES487, ADVANCED TOPICS IN SYSTEMS ENGINEERING
ES487G, ADV TOPICS IN SYSTEMS ENGINEERING
ES495, SYSTEMS ENGR RESEARCH
ES496, SYSTEMS ENGR RESEARCH
ES497, SYSTEMS ENGINEERING RESEARCH
ES498, SYSTEMS ENGINEERING RESEARCH
ES502, HONORS RESEARCH AND DESIGN
ES503, ADVANCED TECHNOLOGIES
ES582, TRIDENT SCHOLAR PROJECT
ES583, TRIDENT SCHOLAR PROJECT
ES584, TRIDENT SCHOLAR PROJECT
ES588, TRIDENT SCHOLAR PROJECT
ES589, TRIDENT SCHOLAR PROJECT
ES590, TRIDENT SCHOLAR PROJECT
ES591, TRIDENT SCHOLAR PROJECT
ES592, TRIDENT SCHOLAR PROJECT
EX281, INTRODUCTION TO ENGINEERING
EX481, PRIN ENGR SYSTEMS DESIGN CAPSTONE PROJ
EX481S, INTERDISCIPLINARY SPECIAL TOPICS
EX482S, INTERDISCIPLINARY SPECIAL TOPICS
EX485, ADVANCED TOPICS IN MECHANICAL ENGINEERING
EX485A, ADVANCED INTERDISCIPLINARY TOPICS IN ENGINEERING
EX485B, INTERDISCIPLINARY CAPSTONE DESIGN
EX485F, INTERDISCIPLINARY CAPSTONE DESIGN
EX485M, INTERDISCIPLINARY CAPSTONE DESIGN
EX485S, INTERDISCIPLINARY CAPSTONE DESIGN
EX486, ADVANCED TOPICS IN MECHANICAL ENGINEERING
EX486A, ADV TOPICS IN ELECTRICAL AND COMPUTER ENGR
EX486B, ADVANCED TOPICS IN MECHANICAL ENGINEERING
EX486C, ADVANCED TOPICS IN MECHANICAL ENGINEERING
EX486F, ADVANCED TOPICS IN MECHANICAL ENGINEERING
EX486M, INTERDISCIPLINARY CAPSTONE DESIGN
EX486S, INTERDISCIPLINARY CAPSTONE DESIGN
EX487A, INTERDISCIPLINARY CAPSTONE DESIGN
EX488A, INTERDISCIPLINARY CAPSTONE DESIGN II
EX491A, INTERDISIPLINARY CAPSTONE DESIGN
EX492A, INTERDISIPLINARY CAPSTONE DESIGN
FA101, BASIC ARABIC I
FA102, BASIC ARABIC II
FA201, INTERMEDIATE  ARABIC I
FA202, INTERMEDIATE ARABIC II
FA202A, INTERMEDIATE ARABIC II
FA281A, TOPICS IN ARABIC STUDIES
FA281B, TOPICS IN ARABIC STUDIES
FA281C, TOPICS IN ARABIC STUDIES
FA282, TOPICS IN ARABIC STUDIES
FA282A, TOPICS IN ARABIC STUDIES
FA282B, TOPICS IN ARABIC STUDIES
FA282C, TOPCIS IN ARABIC STUDIES
FA285I, TOPICS IN ARABIC
FA285J, TOPICS IN ARABIC
FA286, TOPICS IN ARABIC STUDIES
FA286I, TOPICS IN ARABIC
FA286J, TOPICS IN ARABIC
FA287, TOPICS IN ARABIC
FA288, TOPICS IN ARABIC
FA301, ADVANCED ARABIC I
FA302, ADVANCED ARABIC II
FA325, MEDIA ARABIC
FA342, ARABIC DIALECT
FA342G, ARABIC DIALECT (EGYPTIAN)
FA342L, ARABIC DIALECT (LEBANESE)
FA342P, ARABIC DIALECT (PALESTINIAN)
FA350, WINDOW ON ARABIC CULTURE
FA425, ARABIC DISCOURSE IN SOCIETY
FA426, MODERN ARABIC LITERATURE
FA482A, TOPICS IN ARABIC (ARA)
FA485, ADVANCED TOPICS IN ARABIC
FA485A, ADV TOPICS IN ARABIC (ARA)
FA485B, ADV TOPICS IN ARABIC (ARA)
FA486, ADVANCED TOPICS IN ARABIC
FA486A, ADV TOPICS IN ARABIC (ARA)
FA486B, ADV TOPICS IN ARABIC (ARA)
FA486C, ADV TOPICS IN ARABIC (ARA)
FA486E, ADV TOPICS IN ARABIC (ENG)
FA486F, ADV TOPICS IN ARABIC (ENG)
FA495, RESEARCH IN ARABIC
FC101, BASIC CHINESE I
FC102, FIRST-YEAR CHINESE II
FC201, INTERMEDIATE CHINESE I
FC201M, INTERMEDIATE CHINESE I
FC202, SECOND-YEAR CHINESE II
FC202A, INTERMEDIATE CHINESE II
FC280, TOPICS IN CHINESE
FC281, TOPICS IN CHINESE
FC282E, TOPICS IN CHINESE (TAUGHT IN ENGLISH)
FC285E, TOPICS IN CHINESE
FC285I, TOPICS IN CHINESE
FC285J, TOPICS IN CHINESE
FC286, TOPICS IN CHINESE
FC286I, TOPICS IN CHINESE
FC286J, TOPICS IN CHINESE
FC287, TOPICS IN CHINESE
FC288, TOPICS IN CHINESE
FC301, ADVANCED CHINESE I
FC302, THIRD-YEAR CHINESE II
FC350, CHINESE CULTURE THROUGH FILM
FC360, 20TH-CENTURY CHINESE LIT
FC401, CHINESE LANGUAGE & CULTURE I
FC402, CHINESE LANGUAGE & CULTURE II
FC403, CHINESE LANGUAGE & CULTURE III
FC404, CHINESE LANGUAGE & CULTURE IV
FC411, ADVANCED READING & WRITING I
FC412, ADVANCED READING & WRITING II
FC413, ADVANCED READING & WRITING IN CHINESE III
FC414, ADVANCED READING & WRITING IN CHINESE IV
FC450, STYLES OF DISCOURSE IN CHINESE
FC460, CHINESE IN MEDIA
FC484A, ADVANCED TOPICS IN CHINESE
FC485, ADVANCED TOPICS IN CHINESE
FC485A, ADVANCED TOPICS IN CHINESE
FC485B, ADVANCED TOPICS IN CHINESE
FC485C, ADVANCED TOPICS IN CHINESE
FC485E, ADV TOPICS IN CHINESE (ENG)
FC486, ADVANCED TOPICS IN CHINESE
FC486A, ADVANCED TOPICS IN CHINESE
FC486B, ADVANCED TOPICS IN CHINESE
FC486C, ADVANCED TOPICS IN CHINESE
FC486E, ADVANCED TOPICS IN CHINESE (ENG)
FE210, INTRODUCTORY ECONOMICS
FE210M, INTRODUCTORY ECONOMICS - MAJORS ONLY
FE210Q, INTRODUCTORY ECONOMICS
FE220, ACCOUNTING
FE230, PERSONAL FINANCE
FE285A, TOPICS IN ECONOMICS
FE285B, TOPICS IN ECONOMICS
FE285C, TOPICS IN ECONOMICS
FE286A, TOPICS IN ECONOMICS
FE286B, TOPICS IN ECONOMICS
FE286C, TOPICS IN ECONOMICS
FE286D, TOPICS IN ECONOMICS
FE301, FINANCIAL ANALYSIS
FE310, ECONOMIC GEOGRAPHY
FE311, HISTORY OF ECONOMIC THOUGHT
FE312, MACROECONOMICS
FE312Q, MACROECONOMICS
FE314, INTERNATIONAL TRADE  AND POLICY
FE315, ECONOMICS OF DEVELOPING NATIONS
FE320, COST ACCOUNTING
FE321, COMPARATIVE SYSTEMS AND TRANSITIONAL ECONOMIES
FE331, ECONOMIC STATISTICS
FE334, FINANCIAL MARKETS AND INSTITUTIONS
FE335, ECONOMICS OF NATIONAL DEFENSE
FE337, ECONOMICS OF THE DEFENSE INDUSTRIAL BASE
FE341, MICROECONOMICS
FE341Q, MICROECOMOMICS
FE342, ECONOMIC METHODS FOR ENGINEERS
FE345, ENVIRONMENTAL ECONOMICS
FE354, DEVELOPMENT OF THE U.S. ECONOMY
FE362, THE ECONOMICS OF TECHNOLOGY
FE363, MACROECONOMICS
FE363Q, MACROECONOMICS
FE365, MACROECONOMICS
FE365Q, MACROECONOMICS
FE400, ADVANCED MICROECONOMIC THEORY
FE405, ADVANCED MACROECONOMIC THEORY
FE411, ECONOMIC DEVELOPMENT AND GROWTH
FE412, INTERNATIONAL TRADE AND FINANCE
FE422, LABOR ECONOMICS
FE431, PUBLIC FINANCE
FE434, MONEY AND BANKING
FE435, MACROECONOMIC FORECASTING
FE436, BUSINESS CYCLES
FE437, MONETARY THEORY AND POLICY
FE438, ECONOMICS OF FINANCIAL CRISES
FE445, ECONOMETRICS
FE450, GAME THEORY
FE460, PUBLIC POLICIES TOWARD BUSINESS
FE461, INDUSTRIAL ORGANIZATION
FE462, INFORMATION ECONOMICS
FE467, LAW AND ECONOMICS
FE475, RESEARCH SEMINAR IN ECONOMICS
FE475A, RESEARCH SEMINAR
FE475B, RESEARCH SEMINAR
FE475C, RESEARCH SEMINAR
FE475D, RESEARCH SEMINAR
FE475E, RESEARCH SEMINAR
FE475F, RESEARCH SEMINAR
FE475G, RESEARCH SEMINAR
FE475H, RESEARCH SEMINAR
FE475I, RESEARCH SEMINAR
FE475J, RESEARCH SEMINAR
FE475K, RESEARCH SEMINAR
FE475L, RESEARCH SEMINAR
FE480, IT RESEARCH SEMINAR (FE)
FE481, ADVANCED TOPICS IN ECONOMICS
FE481F, ADVANCED TOPICS IN ECONOMICS
FE482, ADVANCED TOPICS IN ECONOMICS
FE482F, ADVANCED TOPICS IN ECONOMICS
FE484, ADVANCED TOPICS IN ECONOMICS
FE485, ADVANCED TOPICS IN ECONOMICS
FE485A, ADVANCED TOPICS IN ECONOMICS
FE485B, ADVANCED TOPICS IN ECONOMICS
FE485C, ADVANCED TOPICS IN ECONOMICS
FE486, ADVANCED TOPICS IN ECONOMICS
FE486A, ADVANCED TOPICS IN ECONOMICS
FE486B, ADVANCED TOPICS IN ECONOMICS
FE486C, ADVANCED TOPICS IN ECONOMICS
FE486E, ADVANCED TOPICS IN ECONOMICS
